{
  "reportVersion": "v1",
  "evidenceType": "runtime-accessibility-test-results",
  "sourceMode": "test-run",
  "testMode": "full",
  "requiredTestMode": "full",
  "generatedAt": "2026-03-04T07:03:55.761533Z",
  "provenance": {
    "commitSha": "653180d2a7c1ef45021f90229bd09b4ac90fa5f0",
    "ciJobId": "local-full-runtime",
    "capturedAt": "2026-03-04T07:03:55.761533Z",
    "testBundleHash": "ffffffffffffffffffffffffffffffffffffffffffffffffffffffffffffffff"
  },
  "executedTests": {
    "ios": 3,
    "android": 3,
    "total": 6
  },
  "platforms": {
    "ios": {
      "runner": "xctest-ui",
      "suiteId": "visual-accessibility-full-ios",
      "testCommand": "echo ios-suite-ok",
      "executedTestCount": 3,
      "allPassed": true,
      "scenarios": [
        {
          "flowId": "planning",
          "passed": true,
          "assertions": {
            "screenReaderLabels": true,
            "focusOrder": true,
            "contrast": true,
            "reducedMotion": true,
            "nonColorSemantics": true
          }
        },
        {
          "flowId": "dashboard",
          "passed": true,
          "assertions": {
            "screenReaderLabels": true,
            "focusOrder": true,
            "contrast": true,
            "reducedMotion": true,
            "nonColorSemantics": true
          }
        },
        {
          "flowId": "settings",
          "passed": true,
          "assertions": {
            "screenReaderLabels": true,
            "focusOrder": true,
            "contrast": true,
            "reducedMotion": true,
            "nonColorSemantics": true
          }
        }
      ]
    },
    "android": {
      "runner": "android-instrumentation",
      "suiteId": "visual-accessibility-full-android",
      "testCommand": "echo android-suite-ok",
      "executedTestCount": 3,
      "allPassed": true,
      "scenarios": [
        {
          "flowId": "planning",
          "passed": true,
          "assertions": {
            "screenReaderLabels": true,
            "focusOrder": true,
            "contrast": true,
            "reducedMotion": true,
            "nonColorSemantics": true
          }
        },
        {
          "flowId": "dashboard",
          "passed": true,
          "assertions": {
            "screenReaderLabels": true,
            "focusOrder": true,
            "contrast": true,
            "reducedMotion": true,
            "nonColorSemantics": true
          }
        },
        {
          "flowId": "settings",
          "passed": true,
          "assertions": {
            "screenReaderLabels": true,
            "focusOrder": true,
            "contrast": true,
            "reducedMotion": true,
            "nonColorSemantics": true
          }
        }
      ]
    }
  }
}
