{
  "reportVersion": "v1",
  "evidenceType": "runtime-accessibility-test-results",
  "sourceMode": "test-run",
  "testMode": "full",
  "requiredTestMode": "full",
  "generatedAt": "2026-03-04T06:33:51.625903Z",
  "provenance": {
    "commitSha": "653180d2a7c1ef45021f90229bd09b4ac90fa5f0",
    "ciJobId": "github-run-local:release-gates",
    "capturedAt": "2026-03-04T06:33:51.625903Z",
    "testBundleHash": "d6cda00fa0e2570df24ac065a551a94673ae20957e5005735efd7bb098271e7a"
  },
  "executedTests": {
    "ios": 3,
    "android": 3,
    "total": 6
  },
  "platforms": {
    "ios": {
      "runner": "xctest-ui",
      "suiteId": "visual-accessibility-full-ios",
      "testCommand": "bash scripts/run_visual_accessibility_runtime_full.sh --output {output}",
      "executedTestCount": 3,
      "allPassed": true,
      "scenarios": [
        {
          "flowId": "planning",
          "passed": true,
          "assertions": {
            "screenReaderLabels": true,
            "focusOrder": true,
            "contrast": true,
            "reducedMotion": true,
            "nonColorSemantics": true
          }
        },
        {
          "flowId": "dashboard",
          "passed": true,
          "assertions": {
            "screenReaderLabels": true,
            "focusOrder": true,
            "contrast": true,
            "reducedMotion": true,
            "nonColorSemantics": true
          }
        },
        {
          "flowId": "settings",
          "passed": true,
          "assertions": {
            "screenReaderLabels": true,
            "focusOrder": true,
            "contrast": true,
            "reducedMotion": true,
            "nonColorSemantics": true
          }
        }
      ]
    },
    "android": {
      "runner": "android-instrumentation",
      "suiteId": "visual-accessibility-full-android",
      "testCommand": "bash scripts/run_visual_accessibility_runtime_full.sh --output {output}",
      "executedTestCount": 3,
      "allPassed": true,
      "scenarios": [
        {
          "flowId": "planning",
          "passed": true,
          "assertions": {
            "screenReaderLabels": true,
            "focusOrder": true,
            "contrast": true,
            "reducedMotion": true,
            "nonColorSemantics": true
          }
        },
        {
          "flowId": "dashboard",
          "passed": true,
          "assertions": {
            "screenReaderLabels": true,
            "focusOrder": true,
            "contrast": true,
            "reducedMotion": true,
            "nonColorSemantics": true
          }
        },
        {
          "flowId": "settings",
          "passed": true,
          "assertions": {
            "screenReaderLabels": true,
            "focusOrder": true,
            "contrast": true,
            "reducedMotion": true,
            "nonColorSemantics": true
          }
        }
      ]
    }
  }
}
