{
  "reportVersion": "v1",
  "evidenceType": "runtime-accessibility-test-results",
  "sourceMode": "test-run",
  "testMode": "smoke",
  "requiredTestMode": "smoke",
  "generatedAt": "2026-03-03T21:50:59.734766Z",
  "provenance": {
    "commitSha": "b6f443283405fefff67b775b9d03f734cd233cf7",
    "ciJobId": "github-run-local:release-gates",
    "capturedAt": "2026-03-03T21:50:59.734766Z",
    "testBundleHash": "12afcf01530674f1207cbd8117d3f0c02f85559b5c960aa1c8439c4bebf4a861"
  },
  "executedTests": {
    "ios": 3,
    "android": 3,
    "total": 6
  },
  "platforms": {
    "ios": {
      "runner": "xctest-ui",
      "suiteId": "visual-accessibility-smoke-ios",
      "testCommand": "python3 scripts/run_visual_accessibility_runtime_test_smoke.py --output {output}",
      "executedTestCount": 3,
      "allPassed": true,
      "scenarios": [
        {
          "flowId": "planning",
          "passed": true,
          "assertions": {
            "screenReaderLabels": true,
            "focusOrder": true,
            "contrast": true,
            "reducedMotion": true,
            "nonColorSemantics": true
          }
        },
        {
          "flowId": "dashboard",
          "passed": true,
          "assertions": {
            "screenReaderLabels": true,
            "focusOrder": true,
            "contrast": true,
            "reducedMotion": true,
            "nonColorSemantics": true
          }
        },
        {
          "flowId": "settings",
          "passed": true,
          "assertions": {
            "screenReaderLabels": true,
            "focusOrder": true,
            "contrast": true,
            "reducedMotion": true,
            "nonColorSemantics": true
          }
        }
      ]
    },
    "android": {
      "runner": "android-instrumentation",
      "suiteId": "visual-accessibility-smoke-android",
      "testCommand": "python3 scripts/run_visual_accessibility_runtime_test_smoke.py --output {output}",
      "executedTestCount": 3,
      "allPassed": true,
      "scenarios": [
        {
          "flowId": "planning",
          "passed": true,
          "assertions": {
            "screenReaderLabels": true,
            "focusOrder": true,
            "contrast": true,
            "reducedMotion": true,
            "nonColorSemantics": true
          }
        },
        {
          "flowId": "dashboard",
          "passed": true,
          "assertions": {
            "screenReaderLabels": true,
            "focusOrder": true,
            "contrast": true,
            "reducedMotion": true,
            "nonColorSemantics": true
          }
        },
        {
          "flowId": "settings",
          "passed": true,
          "assertions": {
            "screenReaderLabels": true,
            "focusOrder": true,
            "contrast": true,
            "reducedMotion": true,
            "nonColorSemantics": true
          }
        }
      ]
    }
  }
}
