{
  "reportVersion": "v1",
  "evidenceType": "runtime-accessibility-test-results",
  "sourceMode": "test-run",
  "testMode": "full",
  "requiredTestMode": "full",
  "generatedAt": "2026-03-03T12:00:00Z",
  "provenance": {
    "commitSha": "8f3a9b1c2d4e5f6a7b8c9d0e1f2a3b4c5d6e7f80",
    "ciJobId": "local-sample",
    "capturedAt": "2026-03-03T12:00:00Z",
    "testBundleHash": "4fe5a18ca8f8475094ff4f9ebcc6c97ce2c2f3a9f25f913db57b35df1b5dc1ea"
  },
  "executedTests": {
    "ios": 42,
    "android": 39,
    "total": 81
  },
  "platforms": {
    "ios": {
      "runner": "xctest-ui",
      "suiteId": "CryptoSavingsTrackerUITests/VisualAccessibilityRelease",
      "testCommand": "xcodebuild -project ios/CryptoSavingsTracker.xcodeproj -scheme CryptoSavingsTrackerUITests -destination 'platform=iOS Simulator,name=iPhone 16e' test",
      "executedTestCount": 42,
      "allPassed": true,
      "scenarios": [
        {
          "flowId": "planning",
          "passed": true,
          "assertions": {
            "screenReaderLabels": true,
            "focusOrder": true,
            "contrast": true,
            "reducedMotion": true,
            "nonColorSemantics": true
          }
        },
        {
          "flowId": "dashboard",
          "passed": true,
          "assertions": {
            "screenReaderLabels": true,
            "focusOrder": true,
            "contrast": true,
            "reducedMotion": true,
            "nonColorSemantics": true
          }
        },
        {
          "flowId": "settings",
          "passed": true,
          "assertions": {
            "screenReaderLabels": true,
            "focusOrder": true,
            "contrast": true,
            "reducedMotion": true,
            "nonColorSemantics": true
          }
        }
      ]
    },
    "android": {
      "runner": "android-instrumentation",
      "suiteId": "app:connectedDebugAndroidTest:VisualAccessibilityRelease",
      "testCommand": "cd android && ./gradlew connectedDebugAndroidTest",
      "executedTestCount": 39,
      "allPassed": true,
      "scenarios": [
        {
          "flowId": "planning",
          "passed": true,
          "assertions": {
            "screenReaderLabels": true,
            "focusOrder": true,
            "contrast": true,
            "reducedMotion": true,
            "nonColorSemantics": true
          }
        },
        {
          "flowId": "dashboard",
          "passed": true,
          "assertions": {
            "screenReaderLabels": true,
            "focusOrder": true,
            "contrast": true,
            "reducedMotion": true,
            "nonColorSemantics": true
          }
        },
        {
          "flowId": "settings",
          "passed": true,
          "assertions": {
            "screenReaderLabels": true,
            "focusOrder": true,
            "contrast": true,
            "reducedMotion": true,
            "nonColorSemantics": true
          }
        }
      ]
    }
  }
}
